{
  "$schema": "https://json-schema.org/draft/2020-12/schema",
  "$id": "https://browserjs.dev/schemas/session-policy/v1.json",
  "title": "browserjs session policy (JSON form), version 1",
  "description": "What an agent connected over MCP may ask a session's browser to do. Deny by default: an operation is allowed if it is not in deny.operations and is either in allow.operations or satisfies one of allow.rules. A browser_execute call is allowed only if every operation in it is.",
  "type": "object",
  "additionalProperties": false,
  "required": ["version"],
  "properties": {
    "version": { "const": 1 },
    "description": { "type": "string", "maxLength": 1024 },
    "allow": {
      "type": "object",
      "additionalProperties": false,
      "properties": {
        "operations": {
          "description": "Operations allowed with any parameters. \"*\" means every operation of version 1.",
          "type": "array",
          "uniqueItems": true,
          "items": { "anyOf": [ { "$ref": "#/$defs/operation" }, { "const": "*" } ] }
        },
        "rules": {
          "description": "Operations allowed when every constraint passes. A constrained parameter that is absent fails.",
          "type": "array",
          "maxItems": 64,
          "items": { "$ref": "#/$defs/rule" }
        }
      }
    },
    "deny": {
      "type": "object",
      "additionalProperties": false,
      "properties": {
        "operations": {
          "description": "Operations refused whatever allow says.",
          "type": "array",
          "uniqueItems": true,
          "items": { "$ref": "#/$defs/operation" }
        }
      }
    }
  },
  "$defs": {
    "operation": {
      "enum": ["click", "evaluate", "navigate", "press", "screenshot", "select", "setContent", "setViewport", "type", "url", "wait"]
    },
    "rule": {
      "type": "object",
      "additionalProperties": false,
      "required": ["operation"],
      "properties": {
        "operation": { "$ref": "#/$defs/operation" },
        "constraints": {
          "description": "Keyed by the name of a parameter of the operation (a key of its params object).",
          "type": "object",
          "maxProperties": 16,
          "propertyNames": { "pattern": "^[A-Za-z_][A-Za-z0-9_]{0,63}$" },
          "additionalProperties": { "$ref": "#/$defs/constraint" }
        }
      }
    },
    "constraint": {
      "type": "object",
      "additionalProperties": false,
      "minProperties": 1,
      "properties": {
        "min": { "description": "The parameter is a number, at least this.", "type": "number" },
        "max": { "description": "The parameter is a number, at most this.", "type": "number" },
        "max_length": { "description": "The parameter is a string of at most this many characters.", "type": "integer", "minimum": 0 },
        "pattern": { "description": "The parameter is a string matching this regular expression (RE2 syntax, unanchored unless it anchors itself).", "type": "string", "maxLength": 1024 },
        "allowed": {
          "description": "The parameter is one of these values.",
          "type": "array",
          "minItems": 1,
          "maxItems": 256,
          "uniqueItems": true,
          "items": { "type": ["string", "number", "boolean"] }
        },
        "hosts": {
          "description": "The parameter is a URL whose host is one of these: an exact name, or *.name for any subdomain of name (not name itself).",
          "type": "array",
          "minItems": 1,
          "maxItems": 256,
          "uniqueItems": true,
          "items": { "type": "string", "maxLength": 255, "pattern": "^(\\*\\.)?[a-z0-9]([a-z0-9-]*[a-z0-9])?(\\.[a-z0-9]([a-z0-9-]*[a-z0-9])?)*$" }
        },
        "schemes": {
          "description": "The parameter is a URL with one of these schemes. Defaults to http and https when hosts is given.",
          "type": "array",
          "minItems": 1,
          "uniqueItems": true,
          "items": { "enum": ["http", "https"] }
        }
      }
    }
  }
}
